<?xml version="1.0" encoding="utf-8"?>

<!DOCTYPE udvar SYSTEM "CSB_udvar.dtd">
<udvar>
    <gazda nev="Alex"/>
    <kutya nev="Nero"></kutya>
    <kakas id="szv_ns3_2jb"/>
    <tyuk ferj="szv_ns3_2jb"/>
    <tyuk ferj="szv_ns3_2jb"/>
    <roka id="szv_ns4_2jb"/>
    <diszno nev="JÃ³zsi"></diszno>
</udvar>